{
  "$schema": "https://json-schema.org/draft/2020-12/schema",
  "title": "egrit-preflight report, schema_version 1",
  "description": "Contract in docs/report-contract.md. Within schema_version 1 only additive changes are made: a consumer ignores unknown properties and rejects any other schema_version. Some rules JSON Schema cannot state (overall and requires_hardware must follow from the checks; jetson.gpu is never PASS) are checked by egrit_preflight.contract.check_report and the fixtures.",
  "type": "object",
  "required": [
    "schema_version",
    "tool",
    "timestamp",
    "hardware_verified",
    "host",
    "docker",
    "target",
    "image",
    "checks",
    "commands",
    "overall",
    "requires_hardware",
    "uncertainties",
    "limitations",
    "provenance"
  ],
  "properties": {
    "schema_version": {
      "const": "1"
    },
    "tool": {
      "type": "object",
      "required": [
        "name",
        "version"
      ],
      "properties": {
        "name": {
          "const": "egrit-preflight"
        },
        "version": {
          "type": "string",
          "minLength": 1,
          "maxLength": 40
        }
      }
    },
    "timestamp": {
      "type": "string",
      "pattern": "^\\d{4}-\\d{2}-\\d{2}T\\d{2}:\\d{2}:\\d{2}Z$",
      "description": "UTC, whole seconds. When SOURCE_DATE_EPOCH is set it is that value, not the clock."
    },
    "hardware_verified": {
      "const": false,
      "description": "Always false. No part of this report is a result from a Jetson or any GPU, whatever 'overall' says."
    },
    "host": {
      "type": "object",
      "required": [
        "os",
        "architecture",
        "execution_mode"
      ],
      "properties": {
        "os": {
          "type": "string"
        },
        "architecture": {
          "type": "string"
        },
        "execution_mode": {
          "type": "string"
        },
        "binfmt_qemu_aarch64": {
          "type": [
            "string",
            "null"
          ]
        },
        "python": {
          "type": "string"
        }
      }
    },
    "docker": {
      "type": "object",
      "required": [
        "cli_version",
        "daemon_version",
        "buildx_version"
      ],
      "properties": {
        "cli_version": {
          "type": [
            "string",
            "null"
          ]
        },
        "daemon_version": {
          "type": [
            "string",
            "null"
          ]
        },
        "buildx_version": {
          "type": [
            "string",
            "null"
          ]
        },
        "daemon_architecture": {
          "type": [
            "string",
            "null"
          ]
        },
        "daemon_os": {
          "type": [
            "string",
            "null"
          ]
        },
        "docker_desktop": {
          "type": [
            "boolean",
            "null"
          ]
        }
      }
    },
    "target": {
      "type": "object",
      "required": [
        "architecture"
      ],
      "properties": {
        "architecture": {
          "const": "linux/arm64"
        },
        "record": {
          "type": [
            "object",
            "null"
          ]
        }
      }
    },
    "image": {
      "type": [
        "object",
        "null"
      ],
      "description": "null when no image was given.",
      "properties": {
        "reference": {
          "type": "string"
        },
        "digest": {
          "type": [
            "string",
            "null"
          ],
          "pattern": "^sha256:[0-9a-f]{64}$"
        },
        "architecture": {
          "type": [
            "string",
            "null"
          ]
        },
        "platforms": {
          "type": [
            "array",
            "null"
          ],
          "items": {
            "type": "string"
          }
        },
        "declared_dependencies": {
          "type": [
            "object",
            "null"
          ]
        },
        "provenance": {
          "type": [
            "object",
            "null"
          ],
          "required": [
            "signature_verified",
            "status",
            "attestations"
          ],
          "properties": {
            "signature_verified": {
              "const": false,
              "description": "Always false. Listed attestations are the publisher's declaration; nothing is verified."
            },
            "status": {
              "enum": [
                "listed",
                "none-published",
                "no-manifest-list",
                "no-arm64-manifest",
                "unreadable"
              ]
            },
            "attestations": {
              "type": "array"
            },
            "arm64_manifest_digests": {
              "type": "array"
            },
            "errors": {
              "type": "array"
            }
          }
        }
      }
    },
    "checks": {
      "type": "array",
      "maxItems": 200,
      "items": {
        "$ref": "#/$defs/check"
      }
    },
    "commands": {
      "type": "array"
    },
    "overall": {
      "enum": [
        "PASS",
        "FAIL",
        "UNKNOWN"
      ],
      "description": "Worst of the checks (FAIL, then UNKNOWN, then PASS). PASS can still come with requires_hardware non-empty."
    },
    "requires_hardware": {
      "type": "array",
      "items": {
        "type": "string"
      },
      "description": "Ids of the checks whose outcome is REQUIRES_HARDWARE."
    },
    "uncertainties": {
      "type": "array",
      "items": {
        "type": "object",
        "required": [
          "id",
          "section",
          "outcome",
          "summary"
        ]
      }
    },
    "limitations": {
      "type": "array",
      "minItems": 1,
      "items": {
        "type": "string"
      }
    },
    "provenance": {
      "type": "object",
      "required": [
        "generated_by",
        "inputs",
        "smoke_executed",
        "telemetry"
      ],
      "properties": {
        "smoke_executed": {
          "type": "boolean"
        }
      }
    }
  },
  "$defs": {
    "check": {
      "type": "object",
      "required": [
        "id",
        "section",
        "outcome",
        "evidence",
        "summary"
      ],
      "properties": {
        "id": {
          "type": "string",
          "pattern": "^[a-z0-9][a-z0-9_.-]{0,79}$"
        },
        "section": {
          "enum": [
            "doctor",
            "image",
            "smoke"
          ]
        },
        "outcome": {
          "enum": [
            "PASS",
            "FAIL",
            "UNKNOWN",
            "REQUIRES_HARDWARE"
          ]
        },
        "evidence": {
          "enum": [
            "observed",
            "declared",
            "none"
          ],
          "description": "observed: this tool saw it on this host. declared: someone said so (a target record, an image tag, a registry listing). none: nothing was established. 'observed' never means observed on a Jetson."
        },
        "summary": {
          "type": "string",
          "maxLength": 4000
        },
        "detail": {
          "description": "Free text or data from the machine, the image or a registry. Not for automatic import."
        },
        "remediation": {
          "type": "string"
        },
        "command": {
          "type": "object",
          "description": "The command line and its bounded output. Not for automatic import."
        }
      }
    }
  }
}
