{
  "checks": [
    {
      "command": {
        "argv": [
          "docker",
          "--version"
        ],
        "returncode": 0,
        "stderr": "",
        "stdout": "Docker version 27.0.1, build abc\n",
        "timed_out": false
      },
      "evidence": "observed",
      "id": "docker.cli",
      "outcome": "PASS",
      "section": "doctor",
      "summary": "Docker CLI 27.0.1."
    },
    {
      "command": {
        "argv": [
          "docker",
          "info",
          "--format",
          "{{json .}}"
        ],
        "output_omitted": true,
        "returncode": 0,
        "timed_out": false
      },
      "evidence": "observed",
      "id": "docker.daemon",
      "outcome": "PASS",
      "section": "doctor",
      "summary": "Docker daemon 27.0.1 reachable."
    },
    {
      "command": {
        "argv": [
          "docker",
          "buildx",
          "version"
        ],
        "returncode": 0,
        "stderr": "",
        "stdout": "github.com/docker/buildx v0.15.1 abc\n",
        "timed_out": false
      },
      "evidence": "observed",
      "id": "docker.buildx",
      "outcome": "PASS",
      "section": "doctor",
      "summary": "Docker Buildx 0.15.1."
    },
    {
      "detail": "mode: linux-arm64-native",
      "evidence": "observed",
      "id": "arm64.execution",
      "outcome": "PASS",
      "section": "doctor",
      "summary": "Native ARM64 Linux: containers run linux/arm64 without emulation."
    },
    {
      "detail": "ARM64 user-space emulation does not emulate a Jetson GPU. Use a physical Jetson for these checks.",
      "evidence": "none",
      "id": "jetson.gpu",
      "outcome": "REQUIRES_HARDWARE",
      "section": "doctor",
      "summary": "CUDA, TensorRT, the NVIDIA driver and Jetson device nodes cannot be tested here."
    },
    {
      "evidence": "observed",
      "id": "reference.valid",
      "outcome": "PASS",
      "section": "image",
      "summary": "Image reference is well formed."
    },
    {
      "evidence": "none",
      "id": "reference.pinned",
      "outcome": "UNKNOWN",
      "remediation": "Resolve a digest: docker buildx imagetools inspect example.com/app:latest ; then use name@sha256:<digest>.",
      "section": "image",
      "summary": "Reference is a mutable tag, so the result is not reproducible."
    },
    {
      "command": {
        "argv": [
          "docker",
          "image",
          "inspect",
          "example.com/app:latest"
        ],
        "returncode": 0
      },
      "evidence": "observed",
      "id": "image.manifest",
      "outcome": "PASS",
      "section": "image",
      "summary": "Image found locally and inspected."
    },
    {
      "evidence": "observed",
      "id": "image.architecture",
      "outcome": "PASS",
      "section": "image",
      "summary": "Image provides linux/arm64."
    },
    {
      "evidence": "none",
      "id": "image.sbom",
      "outcome": "UNKNOWN",
      "section": "image",
      "summary": "SBOM attestation not established: no registry manifest list was available for this reference."
    },
    {
      "evidence": "none",
      "id": "image.provenance",
      "outcome": "UNKNOWN",
      "section": "image",
      "summary": "Build provenance attestation not established: no registry manifest list was available for this reference."
    },
    {
      "evidence": "none",
      "id": "target.jetpack",
      "outcome": "UNKNOWN",
      "section": "image",
      "summary": "JetPack version not compared. No target record supplied (--target)."
    },
    {
      "evidence": "none",
      "id": "target.l4t",
      "outcome": "UNKNOWN",
      "section": "image",
      "summary": "L4T agreement not compared. No target record supplied (--target)."
    },
    {
      "evidence": "none",
      "id": "runtime.cuda",
      "outcome": "UNKNOWN",
      "section": "image",
      "summary": "CUDA version not compared. No target record supplied (--target)."
    },
    {
      "evidence": "none",
      "id": "runtime.tensorrt",
      "outcome": "UNKNOWN",
      "section": "image",
      "summary": "TensorRT version not compared. No target record supplied (--target)."
    },
    {
      "detail": "An inspected manifest or an ARM64 smoke test is not Jetson, CUDA or TensorRT compatibility.",
      "evidence": "none",
      "id": "jetson.gpu",
      "outcome": "REQUIRES_HARDWARE",
      "section": "image",
      "summary": "Whether this image's CUDA/TensorRT user space works on a Jetson GPU needs a physical device."
    }
  ],
  "commands": [
    {
      "argv": [
        "docker",
        "--version"
      ],
      "returncode": 0,
      "stderr": "",
      "stdout": "Docker version 27.0.1, build abc\n",
      "timed_out": false
    },
    {
      "argv": [
        "docker",
        "info",
        "--format",
        "{{json .}}"
      ],
      "output_omitted": true,
      "returncode": 0,
      "timed_out": false
    },
    {
      "argv": [
        "docker",
        "buildx",
        "version"
      ],
      "returncode": 0,
      "stderr": "",
      "stdout": "github.com/docker/buildx v0.15.1 abc\n",
      "timed_out": false
    },
    {
      "argv": [
        "docker",
        "image",
        "inspect",
        "example.com/app:latest"
      ],
      "returncode": 0
    }
  ],
  "docker": {
    "buildx_version": "0.15.1",
    "cli_version": "27.0.1",
    "daemon_architecture": "arm64",
    "daemon_os": "linux",
    "daemon_version": "27.0.1",
    "docker_desktop": true
  },
  "hardware_verified": false,
  "host": {
    "architecture": "arm64",
    "binfmt_qemu_aarch64": "absent",
    "execution_mode": "linux-arm64-native",
    "os": "linux",
    "python": "3.12.0"
  },
  "image": {
    "architecture": "arm64",
    "declared_dependencies": {
      "env": {},
      "labels": {
        "org.opencontainers.image.version": "1"
      }
    },
    "digest": null,
    "platforms": null,
    "provenance": {
      "arm64_manifest_digests": [],
      "attestations": [],
      "errors": [],
      "signature_verified": false,
      "status": "no-manifest-list"
    },
    "reference": "example.com/app:latest"
  },
  "limitations": [
    "ARM64 user-space emulation or a native ARM64 run is not a Jetson run.",
    "CUDA, TensorRT, the NVIDIA driver, device nodes and GPU performance are not tested.",
    "Declared versions (target records, image tags and labels) are not observed on a device.",
    "A mocked or emulated result is never hardware verification."
  ],
  "overall": "UNKNOWN",
  "provenance": {
    "generated_by": "egrit-preflight 0.1.0",
    "inputs": {
      "image_reference": "example.com/app:latest",
      "target_record_sha256": null
    },
    "python": "3.12.0",
    "smoke_executed": false,
    "telemetry": "none; this tool sends nothing anywhere"
  },
  "requires_hardware": [
    "jetson.gpu"
  ],
  "schema_version": "1",
  "target": {
    "architecture": "linux/arm64",
    "record": null
  },
  "timestamp": "2026-10-26T07:33:20Z",
  "tool": {
    "name": "egrit-preflight",
    "version": "0.1.0"
  },
  "uncertainties": [
    {
      "id": "jetson.gpu",
      "outcome": "REQUIRES_HARDWARE",
      "section": "doctor",
      "summary": "CUDA, TensorRT, the NVIDIA driver and Jetson device nodes cannot be tested here."
    },
    {
      "id": "reference.pinned",
      "outcome": "UNKNOWN",
      "section": "image",
      "summary": "Reference is a mutable tag, so the result is not reproducible."
    },
    {
      "id": "image.sbom",
      "outcome": "UNKNOWN",
      "section": "image",
      "summary": "SBOM attestation not established: no registry manifest list was available for this reference."
    },
    {
      "id": "image.provenance",
      "outcome": "UNKNOWN",
      "section": "image",
      "summary": "Build provenance attestation not established: no registry manifest list was available for this reference."
    },
    {
      "id": "target.jetpack",
      "outcome": "UNKNOWN",
      "section": "image",
      "summary": "JetPack version not compared. No target record supplied (--target)."
    },
    {
      "id": "target.l4t",
      "outcome": "UNKNOWN",
      "section": "image",
      "summary": "L4T agreement not compared. No target record supplied (--target)."
    },
    {
      "id": "runtime.cuda",
      "outcome": "UNKNOWN",
      "section": "image",
      "summary": "CUDA version not compared. No target record supplied (--target)."
    },
    {
      "id": "runtime.tensorrt",
      "outcome": "UNKNOWN",
      "section": "image",
      "summary": "TensorRT version not compared. No target record supplied (--target)."
    }
  ]
}
